{
  "id": "wp-drum-v",
  "category": "weapon",
  "displayName": "Vertical Drum",
  "mass": 22,
  "hp": 170,
  "cost": 320,
  "mesh": null,
  "primitive": "box",
  "visualScale": [
    0.34,
    0.22,
    0.22
  ],
  "requiresSocketType": "weapon",
  "colliderSpec": {
    "shape": "cylinder",
    "radius": 0.16,
    "halfHeight": 0.17,
    "friction": 0.35,
    "restitution": 0.1
  },
  "stats": {
    "type": "drumVertical",
    "mode": "spin",
    "axis": [
      1,
      0,
      0
    ],
    "targetRpm": 1100,
    "spinUpSeconds": 1.8,
    "motorMaxForce": 1100,
    "energyLossPerHit": 0.25,
    "jamThresholdRpm": 150,
    "jamCooldownSeconds": 1.2,
    "spinUpGraceSeconds": 0.8,
    "jamFraction": 0.35,
    "sweptEnvelope": true,
    "spinDownSeconds": 3,
    "note": "Shorter, fatter and lower-inertia than the bar spinner: spins up faster, hits more often, hits less hard (T-4.1)."
  }
}
