{
  "id": "wp-hammer-a",
  "category": "weapon",
  "displayName": "Overhead Axe",
  "mass": 16,
  "hp": 160,
  "cost": 280,
  "mesh": null,
  "primitive": "box",
  "visualScale": [
    0.12,
    0.5,
    0.1
  ],
  "requiresSocketType": "weapon",
  "colliderSpec": {
    "shape": "box",
    "halfExtents": [
      0.06,
      0.25,
      0.05
    ],
    "friction": 0.4,
    "restitution": 0.05
  },
  "stats": {
    "type": "hammer",
    "mode": "swing",
    "axis": [
      1,
      0,
      0
    ],
    "restAngleRad": -1.2,
    "strikeAngleRad": 0.9,
    "strikeSeconds": 0.16,
    "recoverSeconds": 0.5,
    "cooldownSeconds": 1.1,
    "motorMaxForce": 2600,
    "motorStiffness": 900,
    "motorDamping": 60,
    "note": "Highest weaponFactor in the table (1.3) but it is only live for strikeSeconds per 1.8 s cycle - burst damage against a spinner's sustained damage (T-4.2)."
  }
}
